{
  "schema_version":"0.1.0","method_version":"ai-native-facility-v0.1","dataset_kind":"synthetic_fixture","synthetic":true,
  "evidence_register":[{"evidence_id":"E-SYN-001","status":"synthetic","description":"Synthetic contract evidence","source_ref":"generated fixture","confidence":"high","limitations":["Not a real facility or design"]}],
  "assumption_register":[{"assumption_id":"A-SYN-001","description":"Synthetic capacities and costs","status":"active","confidence":"high"}],
  "facilities":[{
    "facility_id":"FAC-SYN-ROAD-001","title":"Synthetic reversible machine crossing","facility_class":"road_intersection","calibration_wave":1,"criticality":"critical","assessment_maturity":"tabletop_verified","assessment_status":"assessed","overall_confidence":"high",
    "users":{"human_users":["pedestrians","wheelchair users"],"ai_users":[{"actor_type":"delivery_robot","physical_actions":["traverse","queue","occupy_capacity"]}]},
    "baseline_b0":{"description":"Synthetic non-AI crossing with equal baseline service"},
    "basic_service":{"definition":"safe crossings","unit":"crossings_per_hour","baseline_capacity":100,"required_floor":100,"ai_off_immediate_capacity":100,"capacity_group_id":"safe_crossings"},
    "reverse_design":{"decision":"adapt","why_change":"Synthetic robot envelope requires a physical handoff zone","counterfactual":"Baseline produces a synthetic conflict","necessity_gate":"pass"},
    "physical_change":{"summary":"Synthetic physical interface and circulation change","dimensions":["space","physical_interface","operations"],"interventions":[{"kind":"space","description":"Synthetic queue bay"},{"kind":"physical_interface","description":"Synthetic tactile handoff edge"}],"measurable_changes":[{"attribute":"queue_width","baseline":0,"proposed":1.5,"unit":"m"}]},
    "compatibility":{"human_priority_preserved":true,"non_ai_access_preserved":true,"accessibility_preserved":true,"human_decision_authority":"Human operator and public authority","legacy_compatibility":"Manual crossing remains","interface_strategy":"Open documented physical markers"},
    "operation_states":{"ai_native":{"description":"Synthetic normal state"},"ai_degraded":{
      "network":{"status":"tested","trigger":"network loss","service_floor":"100 crossings/hour","control_authority":"human","safe_state":"manual crossing","max_duration_hours":24,"recovery":"restore network"},
      "localization":{"status":"tested","trigger":"localization loss","service_floor":"100 crossings/hour","control_authority":"human","safe_state":"robot stop","max_duration_hours":24,"recovery":"restore localization"},
      "model":{"status":"tested","trigger":"model unavailable","service_floor":"100 crossings/hour","control_authority":"human","safe_state":"robot stop","max_duration_hours":24,"recovery":"validated fallback"},
      "sensing":{"status":"tested","trigger":"sensor loss","service_floor":"100 crossings/hour","control_authority":"human","safe_state":"robot stop","max_duration_hours":24,"recovery":"replace sensor"},
      "power":{"status":"tested","trigger":"power loss","service_floor":"100 crossings/hour","control_authority":"human","safe_state":"passive crossing","max_duration_hours":24,"recovery":"restore power"},
      "vendor_interface":{"status":"tested","trigger":"vendor exit","service_floor":"100 crossings/hour","control_authority":"public authority","safe_state":"open manual mode","max_duration_hours":24,"recovery":"switch provider"}},
      "ai_off":{"entry_condition":"AI service withdrawn","maintained_basic_services":["safe human crossing"],"control_authority":"public authority","safe_state":"ordinary crossing","conversion_time_hours":1,"recovery_time_objective_hours":10,"conversion_cost_amount":1,"capital_replacement_value_amount":100,"currency":"CNY"}},
    "second_life":{"asset_scope":"fixed_or_long_lived","status":"known","paths":[{"path_type":"alternate_use","description":"Synthetic queue bay becomes accessible waiting space","target_users":["pedestrians"],"conversion_steps":["remove machine marker"],"owner":"public authority","status":"tabletop_verified"}]},
    "gates":{
      "necessity":{"status":"pass","rationale":"synthetic pass","evidence_ids":["E-SYN-001"],"assumption_ids":["A-SYN-001"]},"public_value":{"status":"pass","rationale":"synthetic pass","evidence_ids":["E-SYN-001"],"assumption_ids":[]},
      "safety":{"status":"pass","rationale":"synthetic pass","evidence_ids":["E-SYN-001"],"assumption_ids":[]},"accessibility":{"status":"pass","rationale":"synthetic pass","evidence_ids":["E-SYN-001"],"assumption_ids":[]}},
    "ats":{"components":{
      "p":{"status":"known","score":4,"rationale":"synthetic","evidence_ids":["E-SYN-001"],"assumption_ids":[]},"f":{"status":"known","score":4,"rationale":"synthetic","evidence_ids":["E-SYN-001"],"assumption_ids":[]},
      "i":{"status":"known","score":4,"rationale":"synthetic","evidence_ids":["E-SYN-001"],"assumption_ids":[]},"u":{"status":"known","score":4,"rationale":"synthetic","evidence_ids":["E-SYN-001"],"assumption_ids":[]}},"total":{"status":"known","value":80}},
    "r_score":{"components":{
      "rq":{"status":"known","score":5,"rationale":"100%","evidence_ids":["E-SYN-001"],"assumption_ids":[]},"rt":{"status":"known","score":5,"rationale":"0.1","evidence_ids":["E-SYN-001"],"assumption_ids":[]},
      "rc":{"status":"known","score":5,"rationale":"0.01","evidence_ids":["E-SYN-001"],"assumption_ids":[]},"rd":{"status":"known","score":5,"rationale":"0.05","evidence_ids":["E-SYN-001"],"assumption_ids":[]},
      "ro":{"status":"known","score":4,"rationale":"synthetic open interface","evidence_ids":["E-SYN-001"],"assumption_ids":[]},"rl":{"status":"known","score":4,"rationale":"synthetic tabletop","evidence_ids":["E-SYN-001"],"assumption_ids":[]}},
      "raw":{"retention_pct":100,"time_to_rto_ratio":0.1,"cost_to_crv_ratio":0.01,"ai_dedicated_asset_ratio":0.1,"stranded_ai_asset_ratio":0.05},"total":{"status":"known","value":95}},
    "futures":{
      "boom":{"parameters":{"demand_multiplier":2,"concurrency_multiplier":2,"curb_load_multiplier":1.5},"status":"pass","required_capacity":100,"delivered_capacity":110,"unit":"crossings_per_hour","service_floor_met":true,"safety":"pass","accessibility":"pass","rationale":"synthetic","evidence_ids":["E-SYN-001"],"assumption_ids":["A-SYN-001"]},
      "fragmentation":{"parameters":{"vendor_count":3,"standard_count":2,"single_cloud_unavailable":true},"status":"pass","required_capacity":100,"delivered_capacity":100,"unit":"crossings_per_hour","service_floor_met":true,"safety":"pass","accessibility":"pass","rationale":"synthetic","evidence_ids":["E-SYN-001"],"assumption_ids":["A-SYN-001"]},
      "retreat":{"parameters":{"ai_demand_share_pct":0,"vendor_support_available":false},"status":"pass","required_capacity":100,"delivered_capacity":100,"unit":"crossings_per_hour","service_floor_met":true,"safety":"pass","accessibility":"pass","rationale":"synthetic","evidence_ids":["E-SYN-001"],"assumption_ids":["A-SYN-001"]}},
    "classification":{"declared_quadrant":"high_high","high_high_eligible":true},"evidence_ids":["E-SYN-001"],"assumption_ids":["A-SYN-001"]
  }],
  "portfolio_summary":{"facility_class_ats_medians":[
    {"facility_class":"road_intersection","status":"known","value":80},{"facility_class":"curb_loading","status":"not_applicable","value":null},{"facility_class":"building_entrance","status":"not_applicable","value":null},{"facility_class":"parking","status":"not_applicable","value":null},
    {"facility_class":"park_public_space","status":"not_applicable","value":null},{"facility_class":"lamp_street_furniture","status":"not_applicable","value":null},{"facility_class":"municipal_logistics","status":"not_applicable","value":null},{"facility_class":"energy_edge_node","status":"not_applicable","value":null}],
    "critical_min_r_score":{"status":"known","value":95},"evaluation_coverage_pct":{"status":"known","value":100},
    "high_high_capacity_shares":[{"capacity_group_id":"safe_crossings","unit":"crossings_per_hour","status":"known","numerator":100,"denominator":100,"value_pct":100}]}
}
